{
  "schemaVersion": "1.0.0",
  "modelVersionUri": "https://www.omg.org/spec/SysML/20250201",
  "documents": {
    "kerml": {
      "document": "KerML",
      "version": "1.0"
    },
    "sysml2": {
      "document": "SysML",
      "version": "2.0"
    }
  },
  "provenanceTiers": {
    "NORMATIVE": "Verbatim specification text, clause-anchored. Lives only in the git-ignored knowledge/spec tree.",
    "MODEL": "Read directly from the metamodel XMI by tools/metamodel-gen.",
    "DERIVED": "Computed or asserted by this repository: a closure, a name match, or a curated cross-reference."
  },
  "counts": {
    "elements": 187,
    "withClauses": 185,
    "withoutClauses": 2,
    "withGrammar": 131,
    "withExamples": 30,
    "clauseEdges": 201,
    "grammarEdges": 146,
    "exampleEdges": 43
  },
  "entries": {
    "AcceptActionUsage": {
      "kind": "class",
      "element": "metamodel/elements/AcceptActionUsage.md",
      "clauses": [
        {
          "document": "sysml2",
          "clause": "8.3.17.2",
          "provenance": "DERIVED",
          "method": "exact-title-match"
        }
      ],
      "grammar": [],
      "examples": [
        {
          "file": "textual-notation/examples/states.md",
          "provenance": "DERIVED",
          "method": "curated-front-matter"
        }
      ]
    },
    "ActionDefinition": {
      "kind": "class",
      "element": "metamodel/elements/ActionDefinition.md",
      "clauses": [
        {
          "document": "sysml2",
          "clause": "8.3.17.3",
          "provenance": "DERIVED",
          "method": "exact-title-match"
        }
      ],
      "grammar": [
        {
          "grammar": "sysml",
          "production": "ActionDefinition",
          "provenance": "DERIVED",
          "method": "exact-name-match"
        }
      ],
      "examples": [
        {
          "file": "textual-notation/examples/actions.md",
          "provenance": "DERIVED",
          "method": "curated-front-matter"
        }
      ]
    },
    "ActionUsage": {
      "kind": "class",
      "element": "metamodel/elements/ActionUsage.md",
      "clauses": [
        {
          "document": "sysml2",
          "clause": "8.3.17.4",
          "provenance": "DERIVED",
          "method": "exact-title-match"
        }
      ],
      "grammar": [
        {
          "grammar": "sysml",
          "production": "ActionUsage",
          "provenance": "DERIVED",
          "method": "exact-name-match"
        }
      ],
      "examples": [
        {
          "file": "textual-notation/examples/actions.md",
          "provenance": "DERIVED",
          "method": "curated-front-matter"
        }
      ]
    },
    "ActorMembership": {
      "kind": "class",
      "element": "metamodel/elements/ActorMembership.md",
      "clauses": [
        {
          "document": "sysml2",
          "clause": "8.3.21.2",
          "provenance": "DERIVED",
          "method": "exact-title-match"
        }
      ],
      "grammar": [],
      "examples": []
    },
    "AllocationDefinition": {
      "kind": "class",
      "element": "metamodel/elements/AllocationDefinition.md",
      "clauses": [
        {
          "document": "sysml2",
          "clause": "8.3.15.2",
          "provenance": "DERIVED",
          "method": "exact-title-match"
        }
      ],
      "grammar": [
        {
          "grammar": "sysml",
          "production": "AllocationDefinition",
          "provenance": "DERIVED",
          "method": "exact-name-match"
        }
      ],
      "examples": []
    },
    "AllocationUsage": {
      "kind": "class",
      "element": "metamodel/elements/AllocationUsage.md",
      "clauses": [
        {
          "document": "sysml2",
          "clause": "8.3.15.3",
          "provenance": "DERIVED",
          "method": "exact-title-match"
        }
      ],
      "grammar": [
        {
          "grammar": "sysml",
          "production": "AllocationUsage",
          "provenance": "DERIVED",
          "method": "exact-name-match"
        }
      ],
      "examples": []
    },
    "AnalysisCaseDefinition": {
      "kind": "class",
      "element": "metamodel/elements/AnalysisCaseDefinition.md",
      "clauses": [
        {
          "document": "sysml2",
          "clause": "8.3.23.2",
          "provenance": "DERIVED",
          "method": "exact-title-match"
        }
      ],
      "grammar": [
        {
          "grammar": "sysml",
          "production": "AnalysisCaseDefinition",
          "provenance": "DERIVED",
          "method": "exact-name-match"
        }
      ],
      "examples": []
    },
    "AnalysisCaseUsage": {
      "kind": "class",
      "element": "metamodel/elements/AnalysisCaseUsage.md",
      "clauses": [
        {
          "document": "sysml2",
          "clause": "8.3.23.3",
          "provenance": "DERIVED",
          "method": "exact-title-match"
        }
      ],
      "grammar": [
        {
          "grammar": "sysml",
          "production": "AnalysisCaseUsage",
          "provenance": "DERIVED",
          "method": "exact-name-match"
        }
      ],
      "examples": []
    },
    "AnnotatingElement": {
      "kind": "class",
      "element": "metamodel/elements/AnnotatingElement.md",
      "clauses": [
        {
          "document": "kerml",
          "clause": "8.3.2.3.2",
          "provenance": "DERIVED",
          "method": "exact-title-match"
        }
      ],
      "grammar": [
        {
          "grammar": "kerml",
          "production": "AnnotatingElement",
          "provenance": "DERIVED",
          "method": "exact-name-match"
        },
        {
          "grammar": "sysml",
          "production": "AnnotatingElement",
          "provenance": "DERIVED",
          "method": "exact-name-match"
        }
      ],
      "examples": []
    },
    "Annotation": {
      "kind": "class",
      "element": "metamodel/elements/Annotation.md",
      "clauses": [
        {
          "document": "kerml",
          "clause": "8.3.2.3.3",
          "provenance": "DERIVED",
          "method": "exact-title-match"
        }
      ],
      "grammar": [
        {
          "grammar": "kerml",
          "production": "Annotation",
          "provenance": "DERIVED",
          "method": "exact-name-match"
        },
        {
          "grammar": "sysml",
          "production": "Annotation",
          "provenance": "DERIVED",
          "method": "exact-name-match"
        }
      ],
      "examples": []
    },
    "AssertConstraintUsage": {
      "kind": "class",
      "element": "metamodel/elements/AssertConstraintUsage.md",
      "clauses": [
        {
          "document": "sysml2",
          "clause": "8.3.20.2",
          "provenance": "DERIVED",
          "method": "exact-title-match"
        }
      ],
      "grammar": [
        {
          "grammar": "sysml",
          "production": "AssertConstraintUsage",
          "provenance": "DERIVED",
          "method": "exact-name-match"
        }
      ],
      "examples": []
    },
    "AssignmentActionUsage": {
      "kind": "class",
      "element": "metamodel/elements/AssignmentActionUsage.md",
      "clauses": [
        {
          "document": "sysml2",
          "clause": "8.3.17.5",
          "provenance": "DERIVED",
          "method": "exact-title-match"
        }
      ],
      "grammar": [],
      "examples": []
    },
    "Association": {
      "kind": "class",
      "element": "metamodel/elements/Association.md",
      "clauses": [
        {
          "document": "kerml",
          "clause": "8.3.4.4.2",
          "provenance": "DERIVED",
          "method": "exact-title-match"
        }
      ],
      "grammar": [
        {
          "grammar": "kerml",
          "production": "Association",
          "provenance": "DERIVED",
          "method": "exact-name-match"
        }
      ],
      "examples": []
    },
    "AssociationStructure": {
      "kind": "class",
      "element": "metamodel/elements/AssociationStructure.md",
      "clauses": [
        {
          "document": "kerml",
          "clause": "8.3.4.4.3",
          "provenance": "DERIVED",
          "method": "exact-title-match"
        }
      ],
      "grammar": [
        {
          "grammar": "kerml",
          "production": "AssociationStructure",
          "provenance": "DERIVED",
          "method": "exact-name-match"
        }
      ],
      "examples": []
    },
    "AttributeDefinition": {
      "kind": "class",
      "element": "metamodel/elements/AttributeDefinition.md",
      "clauses": [
        {
          "document": "sysml2",
          "clause": "8.3.7.2",
          "provenance": "DERIVED",
          "method": "exact-title-match"
        }
      ],
      "grammar": [],
      "examples": [
        {
          "file": "textual-notation/examples/part-definitions.md",
          "provenance": "DERIVED",
          "method": "curated-front-matter"
        },
        {
          "file": "textual-notation/examples/ports.md",
          "provenance": "DERIVED",
          "method": "curated-front-matter"
        }
      ]
    },
    "AttributeUsage": {
      "kind": "class",
      "element": "metamodel/elements/AttributeUsage.md",
      "clauses": [
        {
          "document": "sysml2",
          "clause": "8.3.7.3",
          "provenance": "DERIVED",
          "method": "exact-title-match"
        }
      ],
      "grammar": [],
      "examples": [
        {
          "file": "textual-notation/examples/constraints.md",
          "provenance": "DERIVED",
          "method": "curated-front-matter"
        },
        {
          "file": "textual-notation/examples/part-definitions.md",
          "provenance": "DERIVED",
          "method": "curated-front-matter"
        },
        {
          "file": "textual-notation/examples/ports.md",
          "provenance": "DERIVED",
          "method": "curated-front-matter"
        },
        {
          "file": "textual-notation/examples/requirements.md",
          "provenance": "DERIVED",